{
  "agent_name": "AgentXYZ",
  "provider": {
    "company_name": "FinSecure AI Ltd",
    "website": "https://finsecure.ai",
    "contact_email": "compliance@finsecure.ai"
  },
  "primary_use_case": "Retail banking chatbot",
  "industry_vertical": "Finance",
  "deployment_status": "Production",
  "compliance": {
    "standards": [
      "GDPR",
      "SOC 2",
      "ISO 27001"
    ],
    "audit_report_available": true,
    "last_audit_date": "2024-12-01",
    "certification_issuer": "Deloitte AI Risk",
    "certification_expiry_date": "2025-12-01",
    "certification_verified": true,
    "dei_compliance": true
  },
  "risk_profile": {
    "risk_level": "High",
    "incident_history": true,
    "incident_details": "One flagged false positive in July 2023",
    "potential_fines_exposure": "Medium"
  },
  "explainability": {
    "support": "Partial",
    "techniques": [
      "Model Card"
    ],
    "advanced_techniques": [
      "Counterfactual",
      "LIME"
    ]
  },
  "bias_mitigation": {
    "enabled": true,
    "methods": [
      "Training data rebalancing",
      "Post-processing fairness filters"
    ]
  },
  "audit": {
    "frequency": "Annual",
    "third_party_audit": true,
    "auditor_name": "Deloitte",
    "encryption_at_rest": true,
    "encryption_in_transit": true,
    "data_retention_policy": "Configurable",
    "data_retention_days": 30
  },
  "integration": {
    "ecosystem_integrations": [
      "Salesforce",
      "Azure",
      "GCP"
    ],
    "supported_platforms": [
      "ERP",
      "CRM",
      "API"
    ],
    "integration_cost": "Medium"
  },
  "model_behavior": {
    "foundation_model": "GPT-4",
    "fine_tuned": true,
    "fine_tuning_summary": "Finetuned on anonymized banking chat logs",
    "model_update_frequency": "Quarterly"
  },
  "vendor": {
    "maturity": "Enterprise"
  },
  "trust_metadata": {
    "self_certified": true,
    "certification_status": "pending-review",
    "submitted_on": "2025-05-26"
  }
}